Whats the strongest colour?, Alot of people belive Blue but I would say Green. Having fun is the most important!
Whats a good commander to build around, The most popular commander is Atraxa and there are many ways to build around her
Whats the lastest set, The lastest set is Zedndikar rising. It released September 25th 2020
Whos is in the Gatewatch, The Gatewatch consists of 5 Planeswalkers including Jace Chandra Nissa and Agani
When can I casts instants, An instant can be cast any time you have priority over your opponents including on their turns
How do you use lands, Lands are used by tapping them 90 degrees producing one mana of the lands colour unless stated otherwise
What is a usefull tip, Remeber reading the card explains the card
What is the upkeep step, It is the start of your turn where you untap your lands and draw a card from the top of your library